{
  "format": "nexonova.business-composition.v1",
  "profile": "business-auth-internal-requests-0.1.0-d02",
  "files": [
    {
      "source": "templates/business-platform-auth/.dockerignore",
      "destination": ".dockerignore",
      "owner": "auth-core",
      "sha256": "sha256:0360671320ca212db145d97b87ddc7774f6cceb659b2ce845706d24985790a37"
    },
    {
      "source": "templates/business-platform-auth/.gitignore",
      "destination": ".gitignore",
      "owner": "auth-core",
      "sha256": "sha256:19303de6ca358d4f5d0d79b26f2d2e4a9766ad8e22e653dd108e000b0003caf2"
    },
    {
      "source": "templates/business-platform-auth/README.md",
      "destination": "README.md",
      "owner": "auth-core",
      "sha256": "sha256:e2761ba2bf5c38225567d10eb2d241ff046a43c0e89a73bba40acf8787d331d5"
    },
    {
      "source": "templates/business-platform-auth/next-env.d.ts",
      "destination": "next-env.d.ts",
      "owner": "auth-core",
      "sha256": "sha256:879741880b6ab48da99dcc06dcc674d381c9826137b0496bf7bb368f302de9fc"
    },
    {
      "source": "templates/business-platform-auth/next.config.ts",
      "destination": "next.config.ts",
      "owner": "auth-core",
      "sha256": "sha256:c12defa1b9b367d8f30bb793c50e5b0e5966a15a4717375ab2c41e9f5ba49de9"
    },
    {
      "source": "templates/business-platform-auth/package-lock.json",
      "destination": "package-lock.json",
      "owner": "auth-core",
      "sha256": "sha256:23576a5ca10a0410b6c0ebf2f28583c2da0635525a2613de920bc3812daeb2f4"
    },
    {
      "source": "templates/business-platform-auth/package.json",
      "destination": "package.json",
      "owner": "auth-core",
      "sha256": "sha256:f8d30c759bca27aaaa2676335c45d3b0578426085f0a23799650ffbf79198345"
    },
    {
      "source": "templates/business-platform-auth/prisma.config.ts",
      "destination": "prisma.config.ts",
      "owner": "auth-core",
      "sha256": "sha256:708ec00e8ec674bee7fc1e0fce84592104bf42175ead99b3297ef5c7357b0fde"
    },
    {
      "source": "modules/internal-requests/0.1.0/files/prisma.requests.config.ts",
      "destination": "prisma.requests.config.ts",
      "owner": "internal-requests",
      "sha256": "sha256:2ae8baa76edbc253dcde07937dfa200aa603ac2028dc502dcf1f408a2488d3e6"
    },
    {
      "source": "templates/business-platform-auth/prisma/auth/migrations/00000000000000_auth_initial/migration.sql",
      "destination": "prisma/auth/migrations/00000000000000_auth_initial/migration.sql",
      "owner": "auth-core",
      "sha256": "sha256:e060c8da9cacec4cf00343fef92c045cf35cd1ab6e0017f3b3cd485971a1993e"
    },
    {
      "source": "templates/business-platform-auth/prisma/auth/migrations/migration_lock.toml",
      "destination": "prisma/auth/migrations/migration_lock.toml",
      "owner": "auth-core",
      "sha256": "sha256:1db17a8d051aa136110736752c5e1f8b7ed92b6ea8e803112fbbe2497047c210"
    },
    {
      "source": "templates/business-platform-auth/prisma/auth/schema.prisma",
      "destination": "prisma/auth/schema.prisma",
      "owner": "auth-core",
      "sha256": "sha256:67a53c1fab84d62b08c3d2983664e1af6b4128aa0fbae2256ae46bb2560f5487"
    },
    {
      "source": "modules/internal-requests/0.1.0/files/prisma/modules/internal-requests.prisma",
      "destination": "prisma/modules/internal-requests.prisma",
      "owner": "internal-requests",
      "sha256": "sha256:2944001d0439b7cace356af72cbfdf6593725b5bcebee440ebacd82706eba31e"
    },
    {
      "source": "modules/internal-requests/0.1.0/files/prisma/requests-migrations/00000000000001_internal_requests/migration.sql",
      "destination": "prisma/requests-migrations/00000000000001_internal_requests/migration.sql",
      "owner": "internal-requests",
      "sha256": "sha256:72b45213d68bcdd2b492e49a116b1ba7e0541f877db1a1a4cf634c0b87570396"
    },
    {
      "source": "templates/business-platform-auth/scripts/bootstrap-admin.ts",
      "destination": "scripts/bootstrap-admin.ts",
      "owner": "auth-core",
      "sha256": "sha256:0ddfd114fbbf999484b899cf91907fcb4a4961f37148ba6a3e3cbf49d5eaac25"
    },
    {
      "source": "templates/business-platform-auth/scripts/migrate-check.mjs",
      "destination": "scripts/migrate-check.mjs",
      "owner": "auth-core",
      "sha256": "sha256:b018d70a7733c4c12ad3c656132c84c0abe81443f99bb0083ea5c9f594cbc306"
    },
    {
      "source": "modules/internal-requests/0.1.0/files/scripts/requests-response-boundary.mjs",
      "destination": "scripts/requests-response-boundary.mjs",
      "owner": "internal-requests",
      "sha256": "sha256:de46a42b5bc3084d24de60ca9ae70946a217dbcb4876112b3e8aee0c8fee3b3d"
    },
    {
      "source": "modules/internal-requests/0.1.0/files/scripts/start-requests.mjs",
      "destination": "scripts/start-requests.mjs",
      "owner": "internal-requests",
      "sha256": "sha256:4cde0848456d6b5eb46fb09560602177007213f66c18338cc16d599a6376d9c8"
    },
    {
      "source": "templates/business-platform-auth/scripts/start.mjs",
      "destination": "scripts/start.mjs",
      "owner": "auth-core",
      "sha256": "sha256:57c2a595c83ac9b6ffcf57f3460fa2008f68bf1e61ab8502d88dbe4bdb8c9b6e"
    },
    {
      "source": "templates/business-platform-auth/src/app/admin-check/page.tsx",
      "destination": "src/app/admin-check/page.tsx",
      "owner": "auth-core",
      "sha256": "sha256:0f5d76e95da139019b9b90c13bc0ce79cd591a3e7a81c97c200e4bbce5ea55a6"
    },
    {
      "source": "templates/business-platform-auth/src/app/api/admin-check/route.ts",
      "destination": "src/app/api/admin-check/route.ts",
      "owner": "auth-core",
      "sha256": "sha256:5ba2a1df5af1fc6fd57333a56b72265387f8a433060fdf224adf61a03c84e139"
    },
    {
      "source": "templates/business-platform-auth/src/app/api/auth-check/route.ts",
      "destination": "src/app/api/auth-check/route.ts",
      "owner": "auth-core",
      "sha256": "sha256:961d30ff77a747986130d82c3864bc53ef01b7bc15dd066a969819bec515c703"
    },
    {
      "source": "templates/business-platform-auth/src/app/api/auth/[...all]/route.ts",
      "destination": "src/app/api/auth/[...all]/route.ts",
      "owner": "auth-core",
      "sha256": "sha256:d5a4b854c6095e9775f2875048bfece08dce1aa99f20087e81bc9442cf784cf0"
    },
    {
      "source": "modules/internal-requests/0.1.0/files/src/app/api/requests/[id]/route.ts",
      "destination": "src/app/api/requests/[id]/route.ts",
      "owner": "internal-requests",
      "sha256": "sha256:2424a0fb9034fb308e83a1c60701a8cd156ca72c84dff2bab5b9b4ea2b2d03eb"
    },
    {
      "source": "modules/internal-requests/0.1.0/files/src/app/api/requests/route.ts",
      "destination": "src/app/api/requests/route.ts",
      "owner": "internal-requests",
      "sha256": "sha256:2dac8dd41f67d6a2fe5182446f466f455d0560687f42ac2e25dcd594d02a2016"
    },
    {
      "source": "templates/business-platform-auth/src/app/auth-check/page.tsx",
      "destination": "src/app/auth-check/page.tsx",
      "owner": "auth-core",
      "sha256": "sha256:794534a0609c7ee6fd2f3ad2632500f015d1427941bd1f2f818a3e959ca38cea"
    },
    {
      "source": "templates/business-platform-auth/src/app/globals.css",
      "destination": "src/app/globals.css",
      "owner": "auth-core",
      "sha256": "sha256:db0f44fdbab81d12268509b42a46bb622bb8450c8c41688df3f57d26662afc19"
    },
    {
      "source": "templates/business-platform-auth/src/app/layout.tsx",
      "destination": "src/app/layout.tsx",
      "owner": "auth-core",
      "sha256": "sha256:015b442ab1cf36db0f1d12d5796588fc62de90c30467682ba2b77cd1d3205e35"
    },
    {
      "source": "templates/business-platform-auth/src/app/login/login.tsx",
      "destination": "src/app/login/login.tsx",
      "owner": "auth-core",
      "sha256": "sha256:de65b77292331bc2faa22dda784a4f8d1d8c4e4cebad2ab8033231cc015fe2d7"
    },
    {
      "source": "templates/business-platform-auth/src/app/login/page.tsx",
      "destination": "src/app/login/page.tsx",
      "owner": "auth-core",
      "sha256": "sha256:1f0e1b16745aa2056a1fd81be307c4df33c35f264d18bfc2a35544f2576b4f10"
    },
    {
      "source": "templates/business-platform-auth/src/app/logout.tsx",
      "destination": "src/app/logout.tsx",
      "owner": "auth-core",
      "sha256": "sha256:b85343b7203d58b05ebb22171cf23c267f1deae3754d70b202b51680762279ac"
    },
    {
      "source": "templates/business-platform-auth/src/app/page.module.css",
      "destination": "src/app/page.module.css",
      "owner": "auth-core",
      "sha256": "sha256:e8a4327e8c514fc3af5a42ce31d957ac0463acc62d2383386c8e1c978a66d9d1"
    },
    {
      "source": "templates/business-platform-auth/src/app/page.tsx",
      "destination": "src/app/page.tsx",
      "owner": "auth-core",
      "sha256": "sha256:74b63148d0cdab53fb0a571c206d739e17b669ab6e0991e2a9eb25456d453f33"
    },
    {
      "source": "modules/internal-requests/0.1.0/files/src/app/requests/[id]/page.tsx",
      "destination": "src/app/requests/[id]/page.tsx",
      "owner": "internal-requests",
      "sha256": "sha256:ff758cf0cb597b2eb8d3ed9440091280a588b4a4b5fe76bcaadd932283fcb765"
    },
    {
      "source": "modules/internal-requests/0.1.0/files/src/app/requests/editor.tsx",
      "destination": "src/app/requests/editor.tsx",
      "owner": "internal-requests",
      "sha256": "sha256:c445515f10e9119668470daf50dd0c469c447059b17b2c95bd865bf6c7678fae"
    },
    {
      "source": "modules/internal-requests/0.1.0/files/src/app/requests/page.tsx",
      "destination": "src/app/requests/page.tsx",
      "owner": "internal-requests",
      "sha256": "sha256:a6233e58fc5d1d272c29e59547b467dc9fef4349c4ad08b64327da6ba6359593"
    },
    {
      "source": "modules/internal-requests/0.1.0/files/src/app/requests/requests.module.css",
      "destination": "src/app/requests/requests.module.css",
      "owner": "internal-requests",
      "sha256": "sha256:6fd8a2c6d18334cd3ebacb1428e07e65437654375a97ffc8582cd20d70eb860d"
    },
    {